{
  "version": 1,
  "scoringProfile": "agent-authoring-v1",
  "id": "gen-composed-dashboard",
  "category": "composed",
  "taskType": "generation",
  "prompt": "Compose a dashboard container with a bar chart and a flowchart.",
  "expected": {
    "kind": "container"
  },
  "baselineTargets": ["visulet"]
}
