{
  "version": 1,
  "scoringProfile": "agent-authoring-v1",
  "id": "mod-infographic-steps",
  "category": "infographic",
  "taskType": "modification",
  "prompt": "Add a Publish step after Repair.",
  "startingArtifact": "fixtures/infographic-steps.json",
  "expected": {
    "kind": "infographic",
    "visualType": "steps"
  },
  "baselineTargets": ["visulet"]
}
