{
  "version": 1,
  "scoringProfile": "agent-authoring-v1",
  "id": "gen-infographic-steps",
  "category": "infographic",
  "taskType": "generation",
  "prompt": "Create a VisualDocument v0 steps infographic for draft, diagnose, repair.",
  "expected": {
    "kind": "infographic",
    "visualType": "steps"
  },
  "baselineTargets": [
    "visulet"
  ]
}
