{
  "version": 1,
  "scoringProfile": "agent-authoring-v1",
  "id": "mod-composed-dashboard",
  "category": "composed",
  "taskType": "modification",
  "prompt": "Add a KPI metric view inside the dashboard container.",
  "startingArtifact": "fixtures/composed-dashboard.json",
  "expected": {
    "kind": "container"
  },
  "baselineTargets": [
    "visulet"
  ]
}
