{
  "version": 1,
  "scoringProfile": "agent-authoring-v1",
  "id": "holdout-gen-diagram-flowchart",
  "category": "diagram",
  "taskType": "generation",
  "prompt": "Holdout: flowchart of retry/backoff, not used for schema tuning.",
  "expected": {
    "kind": "diagram",
    "visualType": "flowchart"
  },
  "baselineTargets": ["visulet", "mermaid"],
  "holdout": true
}
