{
  "version": 1,
  "scoringProfile": "agent-authoring-v1",
  "id": "repair-chart-encoding",
  "category": "chart",
  "taskType": "generation",
  "prompt": "The bar chart encodes field missing. Patch encoding.y.field to revenue.",
  "expected": {
    "kind": "chart",
    "visualType": "bar"
  },
  "baselineTargets": [
    "visulet",
    "vega-lite"
  ]
}
