{
  "version": 1,
  "scoringProfile": "agent-authoring-v1",
  "id": "mod-diagram-flowchart",
  "category": "diagram",
  "taskType": "modification",
  "prompt": "Add a Reject node from Validate in the flowchart.",
  "startingArtifact": "fixtures/diagram-flowchart.json",
  "expected": {
    "kind": "diagram",
    "visualType": "flowchart"
  },
  "baselineTargets": ["visulet", "mermaid"]
}
