{
  "version": 1,
  "scoringProfile": "agent-authoring-v1",
  "id": "holdout-mod-chart-line",
  "category": "chart",
  "taskType": "modification",
  "prompt": "Holdout: change the line y field label only.",
  "startingArtifact": "fixtures/chart-line.json",
  "expected": {
    "kind": "chart",
    "visualType": "line"
  },
  "baselineTargets": [
    "visulet",
    "vega-lite"
  ],
  "holdout": true
}
