{
  "version": 1,
  "scoringProfile": "agent-authoring-v1",
  "id": "gen-infographic-list",
  "category": "infographic",
  "taskType": "generation",
  "prompt": "Create a VisualDocument v0 list infographic of validate, patch, and render.",
  "expected": {
    "kind": "infographic",
    "visualType": "list"
  },
  "baselineTargets": [
    "visulet"
  ]
}
