{
  "version": 1,
  "scoringProfile": "agent-authoring-v1",
  "id": "holdout-gen-chart-bar",
  "category": "chart",
  "taskType": "generation",
  "prompt": "Holdout: bar chart of regional bookings, not used for prompt tuning.",
  "expected": {
    "kind": "chart",
    "visualType": "bar"
  },
  "baselineTargets": ["visulet", "vega-lite"],
  "holdout": true
}
